rank,category,racename,race_id,rider_name,rider_id,points,jpp,date
1,NC5,National Championships Guam (Hagatna) R.R.,44005,GALEDO Mark John Lexer Guevarra,14351,0.0,0,2024-12-15
1,NC5,National Championships India (Puri) R.R.,43804,BHAGIRATH Bhagirath,37292,0.0,0,2024-12-10
1,NC5,National Championships Taiwan (Taitung) R.R.,43118,FENG Chun Kai,9517,0.0,0,2024-12-09
1,NCT5,National Championships Taiwan (Taitung) I.T.T.,43119,FENG Chun Kai,9517,0.0,0,2024-12-08
1,NCT5,National Championships India (Puri) I.T.T.,43835,SINGH SEKHON Harshveer,32249,0.0,0,2024-12-07
